{
  "$schema": "https://json-schema.org/draft/2020-12/schema",
  "$id": "https://hwspec.org/openhwfp-eval/flow_instance.schema.json",
  "title": "OpenHWFP flow instance",
  "description": "One attempt to process an FP operator configuration through verification, synthesis, and (optionally) physical implementation.",
  "type": "object",
  "required": ["flow_instance_id", "design_id", "library", "operator"],
  "properties": {
    "flow_instance_id": { "type": "string" },
    "design_id": { "type": "string" },
    "library": { "type": "string", "enum": ["openfloat", "hardfloat", "rial", "fpnew", "flopoco", "fpu", "unknown"] },
    "operator": { "type": ["string", "null"] },
    "precision": { "type": ["string", "null"] },
    "exponent_width": { "type": ["integer", "null"] },
    "mantissa_width": { "type": ["integer", "null"] },
    "bitwidth": { "type": ["integer", "null"] },
    "pipeline_depth": { "type": ["integer", "null"] },
    "source_path": { "type": ["string", "null"] },
    "source_commit": {
      "type": "object",
      "additionalProperties": { "type": "string" }
    },
    "environment": {
      "type": "object",
      "properties": {
        "java": { "type": "string" },
        "sbt": { "type": "string" },
        "verilator": { "type": "string" },
        "yosys": { "type": "string" },
        "openroad": { "type": "string" },
        "host": { "type": "string" },
        "timestamp": { "type": "string" }
      }
    },
    "verification": {
      "type": "object",
      "description": "Aggregated from verification_results/*.json.",
      "properties": {
        "status": { "type": "string", "enum": ["pass", "fail", "aborted", "ignored", "unknown", "not_run"] },
        "failure_stage": { "type": ["string", "null"] },
        "failure_category": { "type": ["string", "null"] },
        "failure_message": { "type": ["string", "null"] },
        "tier": { "type": ["integer", "null"] },
        "conformance_level": { "type": ["string", "null"] },
        "reference": { "type": ["object", "null"] },
        "reference_model": { "type": ["string", "null"] },
        "profile": { "type": ["object", "null"] },
        "flag_check": { "type": ["string", "null"] },
        "checks_performed": { "type": ["integer", "null"] },
        "vectors_excluded_by_profile": { "type": ["integer", "null"] },
        "mismatch_count": { "type": ["integer", "null"] },
        "fraction_within_ulp_budget": { "type": ["number", "null"], "description": "(checks - mismatches) / checks" },
        "max_ulp": { "type": ["number", "null"] },
        "mean_ulp": { "type": ["number", "null"] },
        "special_case_coverage": { "type": ["object", "null"] },
        "canary_ok": { "type": ["boolean", "null"] },
        "modes_covered": { "type": ["array", "null"], "items": { "type": "string" } },
        "tininess_covered": { "type": ["array", "null"], "items": { "type": "string" } },
        "runs": { "type": ["array", "null"], "items": { "type": "object" }, "description": "Verbose per-(mode,tininess) records minus identity/environment fields." }
      }
    },
    "synthesis": {
      "type": "object",
      "properties": {
        "status": { "type": "string", "enum": ["pass", "fail", "unknown", "not_run"] },
        "backend": { "type": "string" },
        "cell_count": { "type": ["integer", "null"] },
        "wire_bits": { "type": ["integer", "null"] },
        "estimated_area_nm2": { "type": ["number", "null"] },
        "area_note": { "type": "string" }
      }
    },
    "implementation": {
      "type": "object",
      "properties": {
        "status": { "type": "string", "enum": ["pass", "fail", "unknown", "not_run"] },
        "backend": { "type": "string" },
        "platform": { "type": ["string", "null"] },
        "clock_period_ps": { "type": ["number", "null"], "description": "Target SDC period (ASAP7 picoseconds)." },
        "area_um2": { "type": ["number", "null"], "description": "Finish report_design_area (µm²). Not Yosys generic cell area." },
        "wns": { "type": ["number", "null"], "description": "Finish worst setup slack in ps (6_finish.rpt worst slack max / setup_ws). May be positive. Not OpenSTA 'wns max 0.00' and not repair_tns." },
        "tns": { "type": ["number", "null"], "description": "Finish setup TNS in ps ('tns max' in 6_finish.rpt). Not repair_tns percent." },
        "setup_slack_ps": { "type": ["number", "null"], "description": "Same as wns: finish worst setup slack (ps)." },
        "hold_slack_ps": { "type": ["number", "null"] },
        "grt_period_ps": { "type": ["number", "null"], "description": "FLW-0008 GRT achieved period (ps)." },
        "grt_slack_ps": { "type": ["number", "null"], "description": "FLW-0009 GRT slack (ps)." },
        "achieved_period_ps": { "type": ["number", "null"], "description": "Finish report_clock_min_period period_min (ps)." },
        "fmax_mhz": { "type": ["number", "null"], "description": "Finish report_clock_min_period fmax (MHz)." },
        "util_percent": { "type": ["number", "null"], "description": "Finish report_design_area utilization percent." },
        "route_drc": { "type": ["integer", "null"], "description": "Last DRT-0199 detailed-route violation count." },
        "report_dir": { "type": ["string", "null"] },
        "nickname": { "type": ["string", "null"] },
        "failure_stage": { "type": ["string", "null"] },
        "failure_message": { "type": ["string", "null"] }
      }
    },
    "overall_status": { "type": "string" }
  }
}
