[
  {
    "flow_instance_id": "356fc78d5cca4b07",
    "design_id": "hardfloat/FPADD_11_53",
    "library": "hardfloat",
    "operator": "add",
    "precision": "fp64",
    "exponent_width": 11,
    "mantissa_width": 53,
    "bitwidth": null,
    "pipeline_depth": 0,
    "source_path": "generated/hardfloat/FPADD_11_53.sv",
    "source_commit": {
      "openhwfp-eval": "c1462a7ae2bee4a053519999bf696fe85d25ce20",
      "OpenFloat": "7041c53a0603b325c6fb658163377b03f1701408",
      "berkeley-hardfloat": "072fe42b1cfc2ead6ca56e725adf964ec06f9a4c",
      "rial-tmpfix": "ccd352028851db4b1ff8794b1faf0386b07fcc42"
    },
    "environment": {
      "host": "c370857w",
      "timestamp": "2026-08-18T02:46:25.310256+00:00",
      "java": "openjdk version \"17.0.19\" 2026-04-21",
      "sbt": "sbt version in this project: 1.12.2",
      "verilator": "Verilator 5.020 2024-01-01 rev (Debian 5.020-1)",
      "yosys": "Yosys 0.68+ (git sha1 a5af9d690, Release, GNU /usr/bin/c++ 13.3.0) [github.com/The-OpenROAD-Project/yosys at HEAD]",
      "openroad": "26Q3-1305-gf552262465"
    },
    "verification": {
      "status": "pass",
      "failure_stage": null,
      "failure_category": null,
      "failure_message": null
    },
    "synthesis": {
      "status": "pass",
      "backend": "yosys-generic",
      "cell_count": 10946,
      "wire_bits": 13920,
      "estimated_area_nm2": 1094600.0,
      "area_note": "Generic Yosys cell count times AREA_PER_CELL=100 nm^2 heuristic; not a PDK area."
    },
    "implementation": {
      "status": "not_run",
      "backend": "openroad-asap7",
      "platform": "asap7",
      "clock_period_ps": null,
      "wns": null,
      "tns": null,
      "fmax_mhz": null,
      "util_percent": null,
      "report_dir": null,
      "failure_stage": null,
      "failure_message": null
    },
    "overall_status": "pass:synthesis"
  },
  {
    "flow_instance_id": "86174742d20685ee",
    "design_id": "hardfloat/FPADD_8_24",
    "library": "hardfloat",
    "operator": "add",
    "precision": "fp32",
    "exponent_width": 8,
    "mantissa_width": 24,
    "bitwidth": null,
    "pipeline_depth": 0,
    "source_path": "generated/hardfloat/FPADD_8_24.sv",
    "source_commit": {
      "openhwfp-eval": "c1462a7ae2bee4a053519999bf696fe85d25ce20",
      "OpenFloat": "7041c53a0603b325c6fb658163377b03f1701408",
      "berkeley-hardfloat": "072fe42b1cfc2ead6ca56e725adf964ec06f9a4c",
      "rial-tmpfix": "ccd352028851db4b1ff8794b1faf0386b07fcc42"
    },
    "environment": {
      "host": "c370857w",
      "timestamp": "2026-08-18T02:46:25.310256+00:00",
      "java": "openjdk version \"17.0.19\" 2026-04-21",
      "sbt": "sbt version in this project: 1.12.2",
      "verilator": "Verilator 5.020 2024-01-01 rev (Debian 5.020-1)",
      "yosys": "Yosys 0.68+ (git sha1 a5af9d690, Release, GNU /usr/bin/c++ 13.3.0) [github.com/The-OpenROAD-Project/yosys at HEAD]",
      "openroad": "26Q3-1305-gf552262465"
    },
    "verification": {
      "status": "pass",
      "failure_stage": null,
      "failure_category": null,
      "failure_message": null
    },
    "synthesis": {
      "status": "pass",
      "backend": "yosys-generic",
      "cell_count": 5446,
      "wire_bits": 7275,
      "estimated_area_nm2": 544600.0,
      "area_note": "Generic Yosys cell count times AREA_PER_CELL=100 nm^2 heuristic; not a PDK area."
    },
    "implementation": {
      "status": "fail",
      "backend": "openroad-asap7",
      "platform": "asap7",
      "clock_period_ps": 2000.0,
      "area_um2": 605.0,
      "wns": -353.54,
      "tns": -10061.01,
      "setup_slack_ps": -353.54,
      "hold_slack_ps": 860.2,
      "grt_period_ps": 2301.15,
      "grt_slack_ps": -422.264,
      "achieved_period_ps": 2353.54,
      "fmax_mhz": 424.89,
      "util_percent": 54.0,
      "route_drc": 0,
      "report_dir": "openroad_results/reports/asap7/hardfloat_FPADD_8_24/base",
      "nickname": "hardfloat_FPADD_8_24",
      "failure_stage": "timing",
      "failure_message": "setup slack -353.54 ps at 2000 ps target"
    },
    "overall_status": "fail:timing"
  },
  {
    "flow_instance_id": "bb2940a3a5bf9f9a",
    "design_id": "hardfloat/FPDIV_11_53",
    "library": "hardfloat",
    "operator": "div",
    "precision": "fp64",
    "exponent_width": 11,
    "mantissa_width": 53,
    "bitwidth": null,
    "pipeline_depth": 0,
    "source_path": "generated/hardfloat/FPDIV_11_53.sv",
    "source_commit": {
      "openhwfp-eval": "c1462a7ae2bee4a053519999bf696fe85d25ce20",
      "OpenFloat": "7041c53a0603b325c6fb658163377b03f1701408",
      "berkeley-hardfloat": "072fe42b1cfc2ead6ca56e725adf964ec06f9a4c",
      "rial-tmpfix": "ccd352028851db4b1ff8794b1faf0386b07fcc42"
    },
    "environment": {
      "host": "c370857w",
      "timestamp": "2026-08-18T02:46:25.310256+00:00",
      "java": "openjdk version \"17.0.19\" 2026-04-21",
      "sbt": "sbt version in this project: 1.12.2",
      "verilator": "Verilator 5.020 2024-01-01 rev (Debian 5.020-1)",
      "yosys": "Yosys 0.68+ (git sha1 a5af9d690, Release, GNU /usr/bin/c++ 13.3.0) [github.com/The-OpenROAD-Project/yosys at HEAD]",
      "openroad": "26Q3-1305-gf552262465"
    },
    "verification": {
      "status": "pass",
      "failure_stage": null,
      "failure_category": null,
      "failure_message": null
    },
    "synthesis": {
      "status": "pass",
      "backend": "yosys-generic",
      "cell_count": 8704,
      "wire_bits": 11805,
      "estimated_area_nm2": 870400.0,
      "area_note": "Generic Yosys cell count times AREA_PER_CELL=100 nm^2 heuristic; not a PDK area."
    },
    "implementation": {
      "status": "not_run",
      "backend": "openroad-asap7",
      "platform": "asap7",
      "clock_period_ps": null,
      "wns": null,
      "tns": null,
      "fmax_mhz": null,
      "util_percent": null,
      "report_dir": null,
      "failure_stage": null,
      "failure_message": null
    },
    "overall_status": "pass:synthesis"
  },
  {
    "flow_instance_id": "1683bbe0dddc0450",
    "design_id": "hardfloat/FPDIV_8_24",
    "library": "hardfloat",
    "operator": "div",
    "precision": "fp32",
    "exponent_width": 8,
    "mantissa_width": 24,
    "bitwidth": null,
    "pipeline_depth": 0,
    "source_path": "generated/hardfloat/FPDIV_8_24.sv",
    "source_commit": {
      "openhwfp-eval": "c1462a7ae2bee4a053519999bf696fe85d25ce20",
      "OpenFloat": "7041c53a0603b325c6fb658163377b03f1701408",
      "berkeley-hardfloat": "072fe42b1cfc2ead6ca56e725adf964ec06f9a4c",
      "rial-tmpfix": "ccd352028851db4b1ff8794b1faf0386b07fcc42"
    },
    "environment": {
      "host": "c370857w",
      "timestamp": "2026-08-18T02:46:25.310256+00:00",
      "java": "openjdk version \"17.0.19\" 2026-04-21",
      "sbt": "sbt version in this project: 1.12.2",
      "verilator": "Verilator 5.020 2024-01-01 rev (Debian 5.020-1)",
      "yosys": "Yosys 0.68+ (git sha1 a5af9d690, Release, GNU /usr/bin/c++ 13.3.0) [github.com/The-OpenROAD-Project/yosys at HEAD]",
      "openroad": "26Q3-1305-gf552262465"
    },
    "verification": {
      "status": "pass",
      "failure_stage": null,
      "failure_category": null,
      "failure_message": null
    },
    "synthesis": {
      "status": "pass",
      "backend": "yosys-generic",
      "cell_count": 4510,
      "wire_bits": 6423,
      "estimated_area_nm2": 451000.0,
      "area_note": "Generic Yosys cell count times AREA_PER_CELL=100 nm^2 heuristic; not a PDK area."
    },
    "implementation": {
      "status": "not_run",
      "backend": "openroad-asap7",
      "platform": "asap7",
      "clock_period_ps": null,
      "wns": null,
      "tns": null,
      "fmax_mhz": null,
      "util_percent": null,
      "report_dir": null,
      "failure_stage": null,
      "failure_message": null
    },
    "overall_status": "pass:synthesis"
  },
  {
    "flow_instance_id": "d142bb435c2506c6",
    "design_id": "hardfloat/FPMUL_11_53",
    "library": "hardfloat",
    "operator": "mul",
    "precision": "fp64",
    "exponent_width": 11,
    "mantissa_width": 53,
    "bitwidth": null,
    "pipeline_depth": 0,
    "source_path": "generated/hardfloat/FPMUL_11_53.sv",
    "source_commit": {
      "openhwfp-eval": "c1462a7ae2bee4a053519999bf696fe85d25ce20",
      "OpenFloat": "7041c53a0603b325c6fb658163377b03f1701408",
      "berkeley-hardfloat": "072fe42b1cfc2ead6ca56e725adf964ec06f9a4c",
      "rial-tmpfix": "ccd352028851db4b1ff8794b1faf0386b07fcc42"
    },
    "environment": {
      "host": "c370857w",
      "timestamp": "2026-08-18T02:46:25.310256+00:00",
      "java": "openjdk version \"17.0.19\" 2026-04-21",
      "sbt": "sbt version in this project: 1.12.2",
      "verilator": "Verilator 5.020 2024-01-01 rev (Debian 5.020-1)",
      "yosys": "Yosys 0.68+ (git sha1 a5af9d690, Release, GNU /usr/bin/c++ 13.3.0) [github.com/The-OpenROAD-Project/yosys at HEAD]",
      "openroad": "26Q3-1305-gf552262465"
    },
    "verification": {
      "status": "pass",
      "failure_stage": null,
      "failure_category": null,
      "failure_message": null
    },
    "synthesis": {
      "status": "pass",
      "backend": "yosys-generic",
      "cell_count": 72989,
      "wire_bits": 76014,
      "estimated_area_nm2": 7298900.0,
      "area_note": "Generic Yosys cell count times AREA_PER_CELL=100 nm^2 heuristic; not a PDK area."
    },
    "implementation": {
      "status": "not_run",
      "backend": "openroad-asap7",
      "platform": "asap7",
      "clock_period_ps": null,
      "wns": null,
      "tns": null,
      "fmax_mhz": null,
      "util_percent": null,
      "report_dir": null,
      "failure_stage": null,
      "failure_message": null
    },
    "overall_status": "pass:synthesis"
  },
  {
    "flow_instance_id": "f2ef86f9235a78d0",
    "design_id": "hardfloat/FPMUL_8_24",
    "library": "hardfloat",
    "operator": "mul",
    "precision": "fp32",
    "exponent_width": 8,
    "mantissa_width": 24,
    "bitwidth": null,
    "pipeline_depth": 0,